{
    "_id": {
      "$oid": "691cee06d10432b7f94727d9"
    },
    "parents": [
      "1_5-tCdbpMYmzxbaTXqbgWvwO0WanLwX6"
    ],
    "id": "124KTG3ZzHKyoumzZxXt6CnX4_nwQtylzqVlzJfHs2XE",
    "name": "Ooo: Weekly call - 2025/11/14 15:25 GMT+08:00 - Notes by Gemini",
    "mimeType": "application/vnd.google-apps.document",
    "webViewLink": "https://docs.google.com/document/d/124KTG3ZzHKyoumzZxXt6CnX4_nwQtylzqVlzJfHs2XE/edit?usp=drivesdk",
    "createdTime": "2025-11-14T09:41:30.210Z",
    "modifiedTime": "2025-11-14T11:12:21.923Z",
    "driveId": "0AK6W4i05tbovUk9PVA",
    "size": "44118",
    "content": "ï»¿ğŸ“ íšŒì˜ë¡\r\n2025ë…„ 11ì›” 14ì¼\r\nOoo: Weekly call\r\nì´ˆëŒ€ë¨ Jake Jang Muhammed Ali Bingol Jeff Chung Monica Kim Ale Son Mehdi Beriane Aamir Muhammad Luca Dall'Ava Nil Soroush\r\nì²¨ë¶€íŒŒì¼ Ooo: Weekly call \r\níšŒì˜ ê´€ë ¨ ê¸°ë¡ ìŠ¤í¬ë¦½íŠ¸ ë…¹í™” ì¤‘ \r\n\r\n\r\nìš”ì•½\r\nJeff Chungì€ GPU ìµœì í™” ë° ë°°ì¹˜ MSMì˜ ë¹„ë™ê¸° ëª¨ë“œ ì—°êµ¬ì™€ ì½”ë“œ ë¦¬íŒ©í† ë§ ì‘ì—…ì„ ë³´ê³ í–ˆìœ¼ë©°, Jake Jangì€ ë²¤ì¹˜ë§ˆí¬ì˜ í•„ìš”ì„±ì„ ê°•ì¡°í–ˆìŠµë‹ˆë‹¤. Monica Kimì€ EVM ì½˜í…ì¸  ìŠ¤í¬ë¦½íŠ¸ì˜ êµ¬ì¡°ë¥¼ ì¬êµ¬ì„±í•˜ì—¬ ìƒíƒœ ê°œë…ì— ì´ˆì ì„ ë§ì¶”ë„ë¡ ê°œì„ í–ˆìœ¼ë©°, Aamir MuhammadëŠ” ë¸”ë¡œê·¸ í”Œë«í¼ì˜ ì½˜í…ì¸  ê´€ë¦¬ ê¸°ëŠ¥ê³¼ í†µê³„ ë° í•„í„°ë§ ê¸°ëŠ¥ ìš”ì²­ì— ëŒ€í•œ êµ¬í˜„ ê³„íšì„ ê³µìœ í–ˆìŠµë‹ˆë‹¤. Ale Sonì€ L2 ì±„ë„ íšŒë¡œ ì—…ë°ì´íŠ¸ì™€ ê³µí†µ ì½”ë“œ í¬ë§¤íŒ… ê·œì¹™ì˜ í•„ìš”ì„±ì„ ì œê¸°í–ˆìœ¼ë©°, Mehdi BerianeëŠ” Merkle ì¦ëª…ì„ ìœ„í•œ Groth16 íšŒë¡œ ê°œë°œ ë° ZK Snark verifier êµ¬í˜„ í˜„í™©ì„ ë³´ê³ í–ˆìŠµë‹ˆë‹¤. Muhammed Ali Bingolì€ ì›¹ ê¸°ë°˜ ì„œëª… í†µí•© ë° DKG ì´ˆê¸° ë²„ì „ì„ ì‹œì—°í–ˆìœ¼ë©°, Luca Dall'AvaëŠ” ë°°ì¹˜ ê²€ì¦ ë° Aggregation í”„ë¡œí† ì½œì— ëŒ€í•œ ì—°êµ¬ë¥¼ ê³µìœ í–ˆê³ , Nil SoroushëŠ” ë¸”ë¡œê·¸ ë° ZK ê´€ë ¨ ì—°êµ¬ ë¬¸ì„œ ì—…ë°ì´íŠ¸ ê³„íšì„ ì œì‹œí–ˆìŠµë‹ˆë‹¤. Jake Jangì€ GKP ì±„ë„ì— ëŒ€í•œ ê¸°ìˆ  ê³„íšê³¼ POC ì‹œì—° ëª©í‘œë¥¼ ê³µìœ í•˜ê³ , CRS ì—…ë°ì´íŠ¸, ê³µê°œ ì™€ì´ì–´ ë¶„ë¦¬, í† í¬ EVM ì½”ë“œ ìˆ˜ì •, ì‹ ì„¸ì‚¬ì´ì € ë³´ì•ˆ ë° íš¨ìœ¨ì„± ì—…ë°ì´íŠ¸ë¥¼ í¬í•¨í•œ ì—¬ëŸ¬ ì‹œìŠ¤í…œ ì—…ë°ì´íŠ¸ ë° ê°œì„  ì‚¬í•­ì„ ë…¼ì˜í–ˆìŠµë‹ˆë‹¤.\r\n\r\n\r\nì„¸ë¶€ì •ë³´\r\n* GPU ìµœì í™” ë° ë°°ì¹˜ MSM Jeff Chungì€ ë°°ì¹˜ MSMê³¼ MSMì˜ ë¹„ë™ê¸° ë©”ì„œë“œë¥¼ ì—°êµ¬í•˜ê³  ìˆë‹¤ê³  ë°í˜”ìŠµë‹ˆë‹¤. ê·¸ëŠ” íŠ¹íˆ ë¹„ë™ê¸° ìŠ¤íŠ¸ë¦¼ì„ êµ¬ì„±í•˜ì—¬ CPUì™€ GPU ì‘ì—…ì„ ë™ì‹œì— ì‹¤í–‰í•˜ë ¤ê³  ë…¸ë ¥í–ˆì§€ë§Œ, ì„±ëŠ¥ í–¥ìƒì´ í¬ê²Œ ëˆˆì— ë„ì§€ ì•Šì•˜ë‹¤ê³  ì–¸ê¸‰í–ˆìŠµë‹ˆë‹¤ (00:00:00). Jeff Chungì€ ë˜í•œ Snarkì˜ MSM í—¬í¼ì™€ ìœ ì‚¬í•˜ê²Œ ì¥ì¹˜ì—ì„œ í˜¸ìŠ¤íŠ¸ë¡œ ë°ì´í„°ë¥¼ ë³µì‚¬í•˜ëŠ” ë™ê¸°í™” í•¨ìˆ˜ë¥¼ ì‹¤í—˜í•˜ê³  ìˆë‹¤ê³  ì„¤ëª…í–ˆìŠµë‹ˆë‹¤ (00:03:14).\r\n* ë²¤ì¹˜ë§ˆí¬ í•„ìš”ì„± ë° ì ‘ê·¼ ë°©ì‹ Jake Jangì€ Jeff Chungì—ê²Œ ë¹„ë™ê¸° ëª¨ë“œì— ëŒ€í•œ ë²¤ì¹˜ë§ˆí¬ í…ŒìŠ¤íŠ¸ë¥¼ ì‹œë„í•´ ë³´ì•˜ëŠ”ì§€ ë¬¼ì—ˆê³  (00:03:14), Jeff Chungì€ ì‹¤ì œ ì‚¬ìš© ì‚¬ë¡€ê°€ ë²¤ì¹˜ë§ˆí¬ì™€ ë‹¤ë¥¼ ìˆ˜ ìˆìœ¼ë¯€ë¡œ ì‹¤ì œ ì‚¬ë¡€ì— ë” ì í•©í•œ ìµœì ì˜ ë¹„ë™ê¸°í™” ë°©ì‹ì„ ì°¾ê³  ìˆë‹¤ê³  ë§í–ˆìŠµë‹ˆë‹¤. Jeff Chungì€ ë°°ì¹˜ MSMì˜ ë²¤ì¹˜ë§ˆí¬ ê²°ê³¼ëŠ” ì„±ëŠ¥ í–¥ìƒì„ ë³´ì˜€ì§€ë§Œ (00:05:54), ì‹¤ì œ ì‚¬ìš© ì‚¬ë¡€ì—ì„œëŠ” ì„±ëŠ¥ì´ í–¥ìƒë˜ì§€ ì•Šì•„ ë‹¤ì–‘í•œ ë°°ì¹˜ í¬ê¸°ë¡œ í…ŒìŠ¤íŠ¸í•  ê³„íšì´ë¼ê³  ë°í˜”ìŠµë‹ˆë‹¤. Jake Jangì€ ê° ìƒˆë¡œìš´ ì ‘ê·¼ ë°©ì‹(ë°°ì¹˜ MSM ë° ë¹„ë™ê¸° ëª¨ë“œ)ì˜ ì˜í–¥ì„ í™•ì¸í•˜ê¸° ìœ„í•´ ë²¤ì¹˜ë§ˆí¬ê°€ í•„ìš”í•˜ë‹¤ê³  ê°•ì¡°í–ˆìœ¼ë©° (00:08:05), Jeff Chungì€ ë‹¤ìŒ ì£¼ì— ê²°ê³¼ë¥¼ ê³µìœ í•  ìˆ˜ ìˆì„ ê²ƒìœ¼ë¡œ ì˜ˆìƒí–ˆìŠµë‹ˆë‹¤ (00:09:57).\r\n* ì½”ë“œ ë¦¬íŒ©í† ë§ ë° SNARK ì½”ë“œ ë…¼ì˜ Jeff Chungì€ ê°œë°œì ê²½í—˜ì„ ê°œì„ í•˜ê¸° ìœ„í•´ ì¹´ê³  ê²½ê³ ë¥¼ ìˆ˜ì •í•˜ê³  ì½”ë“œë¥¼ ë¦¬íŒ©í† ë§í•˜ëŠ” ì‘ì—…ë„ ì§„í–‰ ì¤‘ì´ë¼ê³  ë³´ê³ í–ˆìŠµë‹ˆë‹¤ (00:09:57). Jake Jangì€ Jeff Chungì´ ì–¸ê¸‰í•œ SNARKì˜ `commitment 16` ì½”ë“œì— ëŒ€í•´ ì§ˆë¬¸í–ˆê³ , Jeff Chungì€ ê·¸ê²ƒì´ `proof helper`ì˜ ì£¼ìš” ì½”ë“œë¼ê³  í™•ì¸í–ˆìŠµë‹ˆë‹¤ (00:12:08). ê·¸ë“¤ì€ `MSM helper` í•¨ìˆ˜ê°€ ë‚´ì ì„ ìˆ˜í–‰í•˜ëŠ” ê²ƒì´ ì•„ë‹ˆë¼ ë‘ ì…ë ¥ ë²¡í„°ë¥¼ ë°›ì•„ ë™ì¼í•œ ê¸¸ì´ì˜ ë²¡í„°ë¥¼ ë°˜í™˜í•˜ëŠ” ìš”ì†Œë³„ ê³±ì…ˆë§Œ ìˆ˜í–‰í•˜ëŠ” ê²ƒì— ëŒ€í•´ ë…¼ì˜í–ˆìœ¼ë©°, Jake Jangì€ ê·¸ë“¤ì˜ ì½”ë“œì—ì„œë„ ì„¤ì • ë‹¨ê³„ì—ì„œ ë™ì¼í•œ ì‘ì—…ì„ ìˆ˜í–‰í•œë‹¤ê³  ì–¸ê¸‰í–ˆìŠµë‹ˆë‹¤ (00:14:49).\r\n* EVM ì½˜í…ì¸  ìŠ¤í¬ë¦½íŠ¸ ì¬êµ¬ì„± Monica Kimì€ EVM ì‹¤í–‰ íë¦„, ë‚´ë¶€ êµ¬ì¡°, ê²€ì¦ ë° í•©ì˜, ê°€ìŠ¤ ì‹œìŠ¤í…œì„ ë‹¤ë£¨ëŠ” ìŠ¤í¬ë¦½íŠ¸ë¥¼ ì‘ì„±í–ˆì§€ë§Œ, í”¼ë“œë°±ì„ í†µí•´ í•˜ë‚˜ì˜ ë¹„ë””ì˜¤ì— ëª¨ë‘ í¬í•¨í•˜ë©´ êµ¬ì¡°ê°€ ë³µì¡í•´ì§€ê³  í•µì‹¬ ë©”ì‹œì§€ê°€ ë¶ˆë¶„ëª…í•´ì§ˆ ìˆ˜ ìˆìŒì„ ê¹¨ë‹¬ì•˜ìŠµë‹ˆë‹¤. Jake Jangì˜ í”¼ë“œë°±ì„ ë°”íƒ•ìœ¼ë¡œ Monica Kimì€ ì²« ë²ˆì§¸ ë¹„ë””ì˜¤ë¥¼ ë‹¨ìˆœíˆ ìš©ì–´ë¥¼ ì •ì˜í•˜ëŠ” ëŒ€ì‹  ìƒíƒœ ê°œë…, ì¦‰ ìƒíƒœê°€ ìƒì„±ë˜ê³  ì‹œê°„ì´ ì§€ë‚¨ì— ë”°ë¼ ì–´ë–»ê²Œ ë³€í•˜ëŠ”ì§€ì— ì´ˆì ì„ ë§ì¶”ë„ë¡ ì¬êµ¬ì„±í–ˆìŠµë‹ˆë‹¤. Monica Kimì€ êµ¬ì¡°ë¥¼ ì¡°ì •í•˜ì—¬ ì£¼ì œë¥¼ í° ê·¸ë¦¼ì—ì„œ ì„¸ë¶€ ì‚¬í•­ìœ¼ë¡œ ì„¤ëª…í•˜ê³  ê°œë…ì  ëª…í™•ì„±ì„ ë†’ì´ê¸° ìœ„í•´ ìƒíƒœ ê²€ì¦ ì„¹ì…˜ì„ ì¶”ê°€í–ˆìŠµë‹ˆë‹¤ (00:17:13).\r\n* ë¸”ë¡œê·¸ í”Œë«í¼ ì—…ë°ì´íŠ¸ ë° ê¸°ëŠ¥ ìš”ì²­ Aamir MuhammadëŠ” ë¸”ë¡œê·¸ ì½˜í…ì¸  ê´€ë¦¬ ê°€ì´ë“œì™€ í•¨ê»˜ ê²Œì‹œì—ì„œ ìŠ¤í…Œì´ì§•ìœ¼ë¡œ ì „í™˜í•˜ê³  ë¸”ë¡œê·¸ ì„¹ì…˜ì—ì„œ ì½˜í…ì¸ ë¥¼ ìƒˆë¡œ ê³ ì¹  ìˆ˜ ìˆëŠ” ê¸°ëŠ¥ì„ êµ¬í˜„í–ˆë‹¤ê³  ë³´ê³ í–ˆìŠµë‹ˆë‹¤ (00:17:13). Jake Jangì€ ë°©ë¬¸ì ë° ê¸°ì‚¬ë³„ ë…ì ìˆ˜ë¥¼ ì…€ ìˆ˜ ìˆëŠ” í†µê³„ ê¸°ëŠ¥ êµ¬í˜„ì„ ìš”ì²­í–ˆê³ , Aamir MuhammadëŠ” ë¶„ì„ ë„êµ¬ë¥¼ ì‚¬ìš©í•˜ì—¬ ì´ë¥¼ ì²˜ë¦¬í•  ìˆ˜ ìˆë‹¤ê³  ì–¸ê¸‰í–ˆìŠµë‹ˆë‹¤ (00:21:07). Nil SoroushëŠ” ë…¸ì…˜ í—ˆë¸Œì˜ íŒŒì¼ì„ í¸ì§‘í•˜ë©´ ë¸”ë¡œê·¸ ê²Œì‹œë¬¼ì´ ìë™ìœ¼ë¡œ ì—…ë°ì´íŠ¸ë˜ëŠ”ì§€ ë¬¸ì˜í–ˆê³ , Aamir MuhammadëŠ” ìŠ¬ëŸ¬ê·¸ë‚˜ ì„¤ëª…ì„ ë³€ê²½í•˜ë”ë¼ë„ ìµœì‹  ë³€ê²½ ì‚¬í•­ì„ ì¦‰ì‹œ ê°€ì ¸ì™€ ì—…ë°ì´íŠ¸ëœë‹¤ê³  í™•ì¸í–ˆìŠµë‹ˆë‹¤. Jake Jangì€ ë˜í•œ ëª©ë¡ì— ì´ë¯¸ì§€ì™€ ê¸°ì‚¬ë¥¼ íƒœê·¸ë³„ë¡œ í•„í„°ë§í•˜ëŠ” ê¸°ëŠ¥ì„ ì¶”ê°€í•´ ë‹¬ë¼ê³  ìš”ì²­í–ˆê³  (00:23:29), Aamir MuhammadëŠ” ì´ ëª¨ë“  ê²ƒì„ êµ¬í˜„í•  ê²ƒì´ë¼ê³  ì‘ë‹µí–ˆìŠµë‹ˆë‹¤ (00:25:46).\r\n* ì˜¤ë˜ëœ ë¸”ë¡œê·¸ ì½˜í…ì¸  ì—…ë°ì´íŠ¸ ë° UI/UX í”„ë¡¬í”„íŠ¸ Jake Jangì€ íŠ¹ì • ë¸”ë¡œê·¸ ì½˜í…ì¸ ê°€ ì‹ ì„¸ì‚¬ì´ì € ì—…ë°ì´íŠ¸ë¡œ ì¸í•´ ì˜¤ë˜ë˜ì—ˆìŒì„ ì§€ì í•˜ë©°, ì½˜í…ì¸ ë¥¼ ì‚­ì œí•˜ëŠ” ëŒ€ì‹  ì œëª©ì„ \"gk to network gkpì˜ ê³¼ê±°ì™€ ë¯¸ë˜\"ì™€ ê°™ì´ ë³€ê²½í•˜ê³  í˜„ì¬ê¹Œì§€ ì™„ë£Œëœ ì‘ì—…ê³¼ í–¥í›„ ê³„íšì„ ì†Œê°œí•˜ëŠ” ì—…ë°ì´íŠ¸ ë‚´ìš©ì„ ì¶”ê°€í•˜ì—¬ ì „í™˜ì„ ì†Œê°œí•˜ëŠ” ë° ì‚¬ìš©í•  ê²ƒì„ ì œì•ˆí–ˆìŠµë‹ˆë‹¤. Aamir MuhammadëŠ” í•´ë‹¹ ë³€ê²½ ì‚¬í•­ì„ ì ìš©í•˜ê¸°ë¡œ ë™ì˜í–ˆìŠµë‹ˆë‹¤. ë˜í•œ Aamir MuhammadëŠ” UI/UX ê²½í—˜ì„ ê¸°ë°˜ìœ¼ë¡œ ì„¤ê³„ëœ ëª‡ ê°€ì§€ í”„ë¡¬í”„íŠ¸ë¥¼ í…ŒìŠ¤íŠ¸í•˜ì—¬ ì—°êµ¬ ë…¸íŠ¸ì— ì¶”ê°€í–ˆìœ¼ë©°, zk ì±„ë„ ê´€ë¦¬ì ê´€ë ¨ ëª¨ë“  UI ë³€ê²½ ì‚¬í•­ì´ í˜„ì¬ ì‚¬ìš© ì¤‘ì¸ ê³µí†µ í…Œë§ˆë¡œ ì—…ë°ì´íŠ¸ë˜ì—ˆë‹¤ê³  ë³´ê³ í–ˆìŠµë‹ˆë‹¤ (00:28:29). ë‹¤ìŒ ë‹¨ê³„ëŠ” DKGë¥¼ í†µí•©í•˜ëŠ” ê²ƒì´ë©°, ê·¸ í›„ ì‚¬ìš©ì ê²½í—˜ì„ ê°œì„ í•˜ì—¬ ì±„ë„ ìƒì„± ì‹œ ìˆ˜ë™ í•„ë“œë¥¼ ê°€ëŠ¥í•œ í•œ ìë™í™”í•˜ëŠ” ê²ƒì…ë‹ˆë‹¤ (00:31:16).\r\n* ì†Œì…œ ë„¤íŠ¸ì›Œí¬ ë° ì±„ë„ ê´€ë¦¬ì UI ê°„ì†Œí™” Aamir MuhammadëŠ” ì†Œì…œ ë„¤íŠ¸ì›Œí¬ ê´€ë ¨ íŠ¸ìœ— ì¼ì •ì´ ìˆœì¡°ë¡­ê²Œ ì§„í–‰ë˜ê³  ìˆìœ¼ë©°, ë°€ë¦¼ì´ë¼ëŠ” ìºë¦­í„°ì˜ ë‹¤ì–‘í•œ ë²„ì „ì„ ë§Œë“¤ê³  ë¸”ë¡œê·¸ ê²Œì‹œë¬¼ì—ì„œ íŒŒìƒëœ ìŠ¤ë ˆë“œë¥¼ ë§Œë“¤ ê³„íšì´ë¼ê³  ë°í˜”ìŠµë‹ˆë‹¤ (00:31:16). Jake Jangì€ ì±„ë„ ê´€ë¦¬ì ì¸í„°í˜ì´ìŠ¤ê°€ ë„ˆë¬´ ë³µì¡í•˜ë‹¤ê³  ì§€ì í•˜ë©° (00:34:11), Aamir Muhammadì—ê²Œ \"ì±„ë„ ì—´ê¸°\" ë˜ëŠ” \"ì±„ë„ ì°¸ì—¬\" ë‘ ê°œì˜ ë²„íŠ¼ë§Œ ë‚¨ê¸°ê³  ëª¨ë“  ê²ƒì„ ì œê±°í•  ê²ƒì„ ì œì•ˆí–ˆìŠµë‹ˆë‹¤. Jake Jangì€ ì¸í„°í˜ì´ìŠ¤ë¥¼ ë‹¨ìˆœí™”í•˜ê¸° ìœ„í•´ ì‚¬ìš©ì ìœ í˜•ì— ë”°ë¼ ë‹¤ë¥¸ ë©”ë‰´ë¥¼ ì œê³µí•  ê²ƒì„ ì œì•ˆí–ˆìœ¼ë©°, Aamir MuhammadëŠ” DKG í†µí•© í›„ ì´ ë¶€ë¶„ì„ ë‹¨ìˆœí™”í•  ê³„íšì´ë¼ê³  í™•ì¸í–ˆìŠµë‹ˆë‹¤ (00:36:34).\r\n* L2 ì±„ë„ ì‘ì—… ë° í¬ë§¤íŒ… ê·œì¹™ Ale Sonì€ Kevinì´ ì‘ì—…í•œ ê²ƒì— ë§ì¶° L2 ì±„ë„ì— ëŒ€í•œ íšŒë¡œ ì‘ì—…ì„ ì—…ë°ì´íŠ¸í–ˆìœ¼ë©° (00:36:34), í…ŒìŠ¤íŠ¸ ì¤‘ Kevinì˜ ë¸Œëœì¹˜ì—ì„œ ë°œìƒí•˜ëŠ” ê²ƒê³¼ ë™ì¼í•œ ì˜¤ë¥˜ë¥¼ ë°œê²¬í•˜ì—¬ í ê¸¸ì´ ì œí•œì„ 10ìœ¼ë¡œ ë³€ê²½í•œ í›„ ë™ê¸°í™” ì‘ì—…ì´ ì„±ê³µì ìœ¼ë¡œ ì‘ë™í•˜ë„ë¡ ë§Œë“¤ì—ˆìŠµë‹ˆë‹¤. Ale Sonì€ íŒ€ ì „ì²´ì˜ ê³µí†µ ì½”ë“œ í¬ë§¤íŒ… ê·œì¹™ì´ ë¶€ì¡±í•˜ì—¬ ë°œìƒí•˜ëŠ” ë¬¸ì œë¥¼ ì§€ì í•˜ë©°, íŒ€ì˜ ê³µí†µ ê·œì¹™ì„ ë§Œë“¤ ê²ƒì„ ì œì•ˆí–ˆìŠµë‹ˆë‹¤ (00:39:46). Ale Sonì€ í˜„ì¬ ê°„ë‹¨í•œ ê·œì¹™ë§Œ ê°€ì§€ê³  ìˆìœ¼ë©°, ê°€ëŠ¥í•œ í•œ í•œ ì¤„ë¡œ ìœ ì§€í•˜ëŠ” ê²ƒì„ ì„ í˜¸í•˜ëŠ” ìì‹ ì˜ ì„ í˜¸ë„ì™€ ì¼ì¹˜í•˜ë„ë¡ Prettierë¥¼ ì‚¬ìš©í•˜ì—¬ í¬ë§¤íŒ…ì„ ì €ì¥í•˜ê³  ë¦¬í¬ì§€í† ë¦¬ì— í‘¸ì‹œí–ˆë‹¤ê³  ë°í˜”ìŠµë‹ˆë‹¤ (00:43:30).\r\n* GitHub Copilot ë° í´ë¼ì´ì–¸íŠ¸ ë¬¸ì œ ë…¼ì˜ Jeff Chungì€ PRì„ ìš”ì•½í•˜ëŠ” ë° ë„ì›€ì´ ë˜ë„ë¡ GitHub Copilotì„ í†µí•©í•  ê²ƒì„ ì œì•ˆí–ˆê³ , Ale Sonì€ ì´ì— ë™ì˜í–ˆìŠµë‹ˆë‹¤ (00:43:30). Jake Jangì€ Ale Sonì—ê²Œ ì´ì „ì— Select ì±„ë„ì— ì˜¬ë¦° ìŠ¤ëƒ…ìƒ· ê´€ë ¨ ë¬¸ì œ(í´ë¼ì´ì–¸íŠ¸ ë¬¸ì œì¸ì§€ ì‹ ì„¸ì‚¬ì´ì € ë¬¸ì œì¸ì§€)ì— ëŒ€í•´ ì§ˆë¬¸í–ˆìŠµë‹ˆë‹¤. Ale Sonì€ í…ŒìŠ¤íŠ¸ê°€ ì‘ë™í•˜ì§€ ì•ŠëŠ” ì´ìœ ë¥¼ ì°¾ê¸° ìœ„í•´ ëª¨ë“  ì¢…ì†ì„± ì •ë³´ë¥¼ ì œê±°í•˜ê³  ë§¤ê°œë³€ìˆ˜ë¥¼ ì¬í˜„í•˜ë ¤ê³  ì‹œë„í–ˆìœ¼ë©°, Cì—ì„œ í…ŒìŠ¤íŠ¸í•  ë•ŒëŠ” ë¬¸ì œê°€ ì—†ì—ˆê¸° ë•Œë¬¸ì— ìºì‹œ ë¬¸ì œì¼ ìˆ˜ ìˆë‹¤ê³  ì¶”ì¸¡í–ˆìŠµë‹ˆë‹¤ (00:46:47). Ale Sonì€ ì²˜ìŒì— Jake Jangì˜ ë¸Œëœì¹˜ì—ì„œ ë¬¸ì œë¥¼ ë°œê²¬í•œ í›„ ìì‹ ì˜ Cë¡œ ë³€ê²½í–ˆì„ ë•Œ ë™ì¼í•œ ë¬¸ì œê°€ ë°œìƒí•˜ì—¬ ë¡œì»¬ ì½”ë“œì™€ C í™˜ê²½ì˜ ì°¨ì´ì ì„ í™•ì¸í•´ì•¼ í–ˆë‹¤ê³  ì„¤ëª…í–ˆìŠµë‹ˆë‹¤ (00:54:13).\r\n* Groth16 íšŒë¡œ ê°œë°œ Mehdi BerianeëŠ” Jake Jangê³¼ì˜ ë…¼ì˜ ëì— Merkle ì¦ëª… ì‹œìŠ¤í…œì„ ìœ„í•´ ë‹¤ì–‘í•œ ê¹Šì´ì˜ Merkle íŠ¸ë¦¬(N2, N3, N4 ë“±)ì— ëŒ€í•œ Groth16 íšŒë¡œë¥¼ êµ¬í˜„í•˜ê¸°ë¡œ ê²°ì •í–ˆë‹¤ê³  ë³´ê³ í–ˆìŠµë‹ˆë‹¤. Mehdi BerianeëŠ” Merkle ë£¨íŠ¸ë¥¼ í•˜ë‚˜ì˜ ì¶œë ¥ìœ¼ë¡œ ì‚¬ìš©í•˜ì—¬ ì €ì¥ í‚¤, MPT í‚¤ ë° ê°’ì„ ì…ë ¥ìœ¼ë¡œ ë°›ëŠ” íšŒë¡œë¥¼ ì„±ê³µì ìœ¼ë¡œ ìƒì„±í–ˆë‹¤ê³  ë°í˜”ìŠµë‹ˆë‹¤. ì˜ˆë¥¼ ë“¤ì–´, N2 íšŒë¡œëŠ” 16ê°œì˜ ë¦¬í”„ë¥¼ ê°€ì§€ë©°, N3ëŠ” 64ê°œ, N4ëŠ” 256ê°œì˜ ë¦¬í”„ë¥¼ ê°€ì§‘ë‹ˆë‹¤ (00:54:13).\r\n* ZK Snark ë° Verifier êµ¬í˜„ Mehdi BerianeëŠ” 64ê°œ ë¦¬í”„ì— ëŒ€í•œ Groth16 ë°±ì—”ë“œ ê²€ì¦ í‚¤ë¥¼ ìƒì„±í•˜ê³  ì¦ëª… ìƒì„± ìŠ¤í¬ë¦½íŠ¸ë¥¼ ì„±ê³µì ìœ¼ë¡œ ë§Œë“¤ì—ˆë‹¤ê³  ë³´ê³ í–ˆìŠµë‹ˆë‹¤. 16ê°œ ë¦¬í”„ì— ëŒ€í•œ Groth16 verifierëŠ” ì •ìƒì ìœ¼ë¡œ ì‘ë™í•˜ë©°, 64ê°œ ë¦¬í”„ì— ëŒ€í•œ ë¹„ìš©ì€ ì•½ 150ë§Œ ê°€ìŠ¤ ì†Œë¹„ë¡œ ì˜ˆìƒë˜ì§€ë§Œ (00:56:41), 256ê°œ ë¦¬í”„ì— ëŒ€í•œ verifierëŠ” ë„ˆë¬´ ë¹„ì‹¸ì„œ ë°°í¬í•  ìˆ˜ ì—†ì„ ê²ƒì´ë©°, G1 ìŠ¤ì¹¼ë¼ ê³±ì…ˆì´ 512ê°œê°€ í•„ìš”